{
  "schemaVersion": "aim-question-crosswalk-v2",
  "sourceQuestionBankVersion": "aim-stage2-question-bank-342-v1",
  "targetQuestionRegistryVersion": "aim-question-registry-v2",
  "expectedDispositionCounts": {
    "keep": 42,
    "merge": 212,
    "replace": 35,
    "remove": 53
  },
  "entries": [
    {
      "sourceId": "S2.F1.Q1",
      "disposition": "keep",
      "targetIds": [
        "S2.CML.Q01"
      ],
      "rationale": "Exact direct-end-customer-selling predicate retained."
    },
    {
      "sourceId": "S2.F1.Q2",
      "disposition": "replace",
      "targetIds": [
        "S2.CML.Q02"
      ],
      "rationale": "“Acquire” narrowed to responsibility for winning customers or new logos; prospecting alone cannot satisfy it."
    },
    {
      "sourceId": "S2.F1.Q3",
      "disposition": "merge",
      "targetIds": [
        "S2.CML.Q10"
      ],
      "rationale": "Existing-account ownership consolidated with duplicate relationship and lifecycle questions."
    },
    {
      "sourceId": "S2.F1.Q4",
      "disposition": "merge",
      "targetIds": [
        "S2.CML.Q22"
      ],
      "rationale": "Managing or growing channel partners is the same ongoing indirect-network responsibility."
    },
    {
      "sourceId": "S2.F1.Q5",
      "disposition": "merge",
      "targetIds": [
        "S2.CML.Q19"
      ],
      "rationale": "Indirect-network recruitment predicates have the same channel-build/recruit consequence."
    },
    {
      "sourceId": "S2.F1.Q6",
      "disposition": "merge",
      "targetIds": [
        "S2.CML.Q20"
      ],
      "rationale": "Partner onboarding, activation, enablement, training, and certification share the enablement domain."
    },
    {
      "sourceId": "S2.F1.Q7",
      "disposition": "merge",
      "targetIds": [
        "S2.CML.Q21"
      ],
      "rationale": "Co-selling and joint opportunity or pipeline development share one channel-depth domain."
    },
    {
      "sourceId": "S2.F1.Q8",
      "disposition": "merge",
      "targetIds": [
        "S2.CML.Q22"
      ],
      "rationale": "Distributor, dealer, and indirect-network management consolidated with other ongoing channel management."
    },
    {
      "sourceId": "S2.F1.Q9",
      "disposition": "merge",
      "targetIds": [
        "S2.CML.Q22"
      ],
      "rationale": "Alliance and ecosystem relationship management has the same ongoing indirect-network consequence."
    },
    {
      "sourceId": "S2.F1.Q10",
      "disposition": "replace",
      "targetIds": [
        "S2.CML.Q10",
        "S2.CML.Q13"
      ],
      "rationale": "Customer-success ownership and adoption/value-realization responsibility route differently."
    },
    {
      "sourceId": "S2.F1.Q11",
      "disposition": "merge",
      "targetIds": [
        "S2.CML.Q14"
      ],
      "rationale": "Retention and renewals share the same bounded post-sale growth tier."
    },
    {
      "sourceId": "S2.F1.Q12",
      "disposition": "merge",
      "targetIds": [
        "S2.CML.Q14"
      ],
      "rationale": "Upsell, cross-sell, and account expansion share the same bounded post-sale growth tier."
    },
    {
      "sourceId": "S2.F1.Q13",
      "disposition": "replace",
      "targetIds": [
        "S2.TX.Q01",
        "S2.TX.Q03",
        "S2.TX.Q04",
        "S2.TX.Q05",
        "S2.TX.Q06"
      ],
      "rationale": "Old compound crossed discovery, solution design, demos, POC scoping, and POC execution."
    },
    {
      "sourceId": "S2.F1.Q14",
      "disposition": "merge",
      "targetIds": [
        "S2.CML.Q25"
      ],
      "rationale": "Marketing, sponsorship, influencer, and brand partnerships have one generic-partnership consequence."
    },
    {
      "sourceId": "S2.F1.Q15",
      "disposition": "merge",
      "targetIds": [
        "S2.CML.Q04"
      ],
      "rationale": "Demand generation, lead generation, and campaign execution share one route."
    },
    {
      "sourceId": "S2.F1.Q16",
      "disposition": "replace",
      "targetIds": [
        "S2.CML.Q26"
      ],
      "rationale": "Forecasting narrowed to forecasting operations; owned forecast delivery remains separately sourced by S2.CML.Q32."
    },
    {
      "sourceId": "S2.F1.Q17",
      "disposition": "replace",
      "targetIds": [
        "S2.CML.Q11",
        "S2.CML.Q20",
        "S2.CML.Q27"
      ],
      "rationale": "Customer, partner, and internal-seller enablement have different consequences."
    },
    {
      "sourceId": "S2.F1.Q18",
      "disposition": "merge",
      "targetIds": [
        "S2.CML.Q11"
      ],
      "rationale": "Onboarding, implementation, deployment, and customer launch share the same lifecycle tier."
    },
    {
      "sourceId": "S2.F1.Q19",
      "disposition": "merge",
      "targetIds": [
        "S2.CML.Q12"
      ],
      "rationale": "Ongoing support, service, and issue resolution share the same post-sale tier."
    },
    {
      "sourceId": "S2.F1.Q20",
      "disposition": "keep",
      "targetIds": [
        "S2.CML.Q08"
      ],
      "rationale": "Exact commercial-terms negotiation predicate retained."
    },
    {
      "sourceId": "S2.F2.Q1",
      "disposition": "merge",
      "targetIds": [
        "S2.CML.Q10"
      ],
      "rationale": "“Primary” adds no separate tier; explicit ongoing account ownership supplies the needed fact."
    },
    {
      "sourceId": "S2.F2.Q2",
      "disposition": "replace",
      "targetIds": [
        "S2.CML.Q10",
        "S2.SC.Q11"
      ],
      "rationale": "Account relationship ownership and portfolio/book scope are distinct facts."
    },
    {
      "sourceId": "S2.F2.Q3",
      "disposition": "remove",
      "targetIds": [],
      "rationale": "Prospect relationship-building alone supplies no approved tier and proves neither discovery, qualification, nor acquisition."
    },
    {
      "sourceId": "S2.F2.Q4",
      "disposition": "merge",
      "targetIds": [
        "S2.CML.Q10"
      ],
      "rationale": "Maintaining customer relationships after sale is ongoing account responsibility."
    },
    {
      "sourceId": "S2.F2.Q5",
      "disposition": "remove",
      "targetIds": [],
      "rationale": "Executive contact does not establish executive advice, influence, or decision authority."
    },
    {
      "sourceId": "S2.F2.Q6",
      "disposition": "remove",
      "targetIds": [],
      "rationale": "Generic business-stakeholder relationship management has no distinct approved route."
    },
    {
      "sourceId": "S2.F2.Q7",
      "disposition": "remove",
      "targetIds": [],
      "rationale": "Managing a technical stakeholder relationship does not establish technical work or authority."
    },
    {
      "sourceId": "S2.F2.Q8",
      "disposition": "remove",
      "targetIds": [],
      "rationale": "Procurement, legal, finance, or commercial contact has no distinct approved route."
    },
    {
      "sourceId": "S2.F2.Q9",
      "disposition": "merge",
      "targetIds": [
        "S2.CML.Q22"
      ],
      "rationale": "Ongoing channel or reseller relationships are the same indirect-network management fact."
    },
    {
      "sourceId": "S2.F2.Q10",
      "disposition": "merge",
      "targetIds": [
        "S2.CML.Q22"
      ],
      "rationale": "Distributor, dealer, or agent relationships are the same indirect-network management fact."
    },
    {
      "sourceId": "S2.F2.Q11",
      "disposition": "merge",
      "targetIds": [
        "S2.CML.Q22"
      ],
      "rationale": "Strategic-alliance and ecosystem relationships are the same ongoing indirect-network fact."
    },
    {
      "sourceId": "S2.F2.Q12",
      "disposition": "remove",
      "targetIds": [],
      "rationale": "Technology, implementation, and service-partner relationships are not necessarily channel work and have no separate tier."
    },
    {
      "sourceId": "S2.F2.Q13",
      "disposition": "merge",
      "targetIds": [
        "S2.LI.Q07"
      ],
      "rationale": "Coordinating multiple stakeholder groups within one account is stakeholder coordination."
    },
    {
      "sourceId": "S2.F2.Q14",
      "disposition": "remove",
      "targetIds": [],
      "rationale": "Trusted-advisor wording has no unique approved route and proves neither ownership nor technical/executive advice."
    },
    {
      "sourceId": "S2.F2.Q15",
      "disposition": "merge",
      "targetIds": [
        "S2.CML.Q12"
      ],
      "rationale": "Relationship escalation responsibility consolidates with ongoing support and issue resolution."
    },
    {
      "sourceId": "S2.F2.Q16",
      "disposition": "merge",
      "targetIds": [
        "S2.LI.Q09"
      ],
      "rationale": "Voice-of-customer or partner representation is the same internal-representation predicate."
    },
    {
      "sourceId": "S2.F2.Q17",
      "disposition": "merge",
      "targetIds": [
        "S2.LI.Q07"
      ],
      "rationale": "Coordinating customer relationships with internal sales/account teams supplies stakeholder coordination."
    },
    {
      "sourceId": "S2.F2.Q18",
      "disposition": "merge",
      "targetIds": [
        "S2.LI.Q07"
      ],
      "rationale": "Coordination across product, engineering, support, implementation, or service teams supplies the same tier."
    },
    {
      "sourceId": "S2.F2.Q19",
      "disposition": "merge",
      "targetIds": [
        "S2.CML.Q25"
      ],
      "rationale": "Creator, influencer, sponsor, and brand-partner relationships are the same generic-partnership motion."
    },
    {
      "sourceId": "S2.F2.Q20",
      "disposition": "remove",
      "targetIds": [],
      "rationale": "Recurring internal relationships are ordinary collaboration and do not establish leadership or influence."
    },
    {
      "sourceId": "S2.F3.Q1",
      "disposition": "remove",
      "targetIds": [],
      "rationale": "Segmentation or account planning has no distinct approved tier."
    },
    {
      "sourceId": "S2.F3.Q2",